{
  "id": 12345,
  "username": "john_doe",
  "email": "john.doe@example.com",
  "profile": {
    "firstName": "John",
    "lastName": "Doe",
    "age": 30,
    "bio": "Software developer passionate about open source.",
    "avatar": "https://example.com/avatars/john.jpg"
  },
  "roles": ["user", "moderator"],
  "settings": {
    "notifications": true,
    "theme": "dark",
    "language": "en-US"
  },
  "createdAt": "2024-01-15T10:30:00Z",
  "metadata": null
}
